recipe_id,recipe_image,category1,category2,category3,category4,food_name,steps,ingredient_all,serving_size,cooking_time,cooking_level,tags
7040837,https://recipe1.ezmember.co.kr/cache/recipe/2024/12/18/bcc6fa19204a0cfc2ac7dbc3a610c1301.jpg,끓이기,일상,돼지고기,밑반찬,떠먹는 장조림,"[(1, '메추리알은 물에 헹궈서 준비해요.'), (2, '홍고추와 청고추는 송송 썰어요.'), (3, '냄비에 다짐육과 미림, 후추를 넣어 물기없이 볶아요.'), (4, '고기가 익으면 다시육수와 메추리알, 간장, 설탕, 참치액을 넣어 중불에서 끓여요.'), (5, '메추리알에 색이 알맞게 배이면 약불로 줄이고 홍고추와 청고추를 넣어요.'), (6, '5분간 더 끓여 완성해요.')]","['돼지고기 다짐육: 300g', '다시마육수: 500ml', '진간장: 100ml', '설탕: 1T', '참치액: 1T', '미림: 2T', '후추: 약간', '메추리알: 500g', '홍고추: 1/2개', '청고추: 1/2개']",4인분,30분 이내,아무나,"['장조림', '메추리알장조림']"
7002427,https://recipe1.ezmember.co.kr/cache/recipe/2023/05/18/4234f3ed2df974b3458adf7aef4b1fc51.jpg,끓이기,일상,돼지고기,메인반찬,돼지고기감자조림 밥통이 거덜날 수 있어요,"[(1, '양파1/2개 채썰어주고 대파 1/2대, 청양고추 3개 어슷썰기 합니다 감자도 적당한 크기로 썰어주세요'), (2, '예열한 팬에 기름을 살짝 두른 후 양파 넣어 볶아주세요 참치액젓 1큰술 넣고 볶다가 설탕 1.5큰술 넣어주세요'), (3, '설탕이 녹기 시작하면 고기를 넣어 볶아요'), (4, '고기를 완전히 익힌 후 분량의 양념을 넣어 살짝 졸인 후 잘 볶아요 (센불)'), (5, '물 200ml 추가한 후 끓기 시작하면 감자를 넣어주세요 (뚜껑닫고 중불 5~7분 익혀요)'), (6, '청양고추, 대파, 다진마늘 1큰술 넣어 약불에서 더 익혀주면 완성입니다.')]","['감자: 3개', '돼지고기 앞다리살: 250g', '양파: 1/2개', '청양고추: 3개', '대파: 1/2대', '다진마늘: 1큰술', '참치액젓: 1큰술', '진간장: 1.5큰술', '설탕: 1.5큰술', '맛술: 2큰술', '고춧가루: 1큰술', '고추장: 1큰술']",3인분,20분 이내,아무나,"['돼지고기감자조림', '감자조림', '매운감자조림']"
6952146,https://recipe1.ezmember.co.kr/cache/recipe/2021/01/27/a8dec739f64598cb843a2356eb6bf21e1.jpg,끓이기,일상,돼지고기,메인반찬,"쉽고 맛있는 ""돼지고기 짜글이"" 만들기","[(1, '돼지고기 400g, 감자 3개, 애호박 1개, 양파(1개)를 깍둑썰기로 잘라서 넓은 냄비 바닦에 깔아 줍니다.'), (2, '청양고추 3개, 당근 1/3개를 슬라이스 쳐서 올려 담아 줍니다.'), (3, '고추장 3스푼, 설탕 2스푼, 다진 마늘 1스푼, 간장 1스푼, 소금 0.5스푼, 고춧가루 2스푼, 넣어주면 준비는 끝입니다.'), (4, '식용유를 3스푼 둘러주고 바닥에 눌어붙지 않도록 잘 뒤적여 주면서 센 불에 5분간 볶아 줍니다.'), (5, '야채에서 물이 나오기 때문에 끓일 때에는 물 0.5컵 정도만 담아서 끓여주시면 됩니다. 대략 10분 정도 끓여주시면 되는데 불의 세기에 따라서 고기가 완전히 익을 정도 만 조리하시면 두꺼운 야채도 충분히 익힌 상태가 됩니다.')]","['돼지고기앞다리살: 400g', '감자: 3개', '양파: 1개', '당근: 1/3개', '애호박: 1개', '청양고추: 3개', '고추장: 3스푼', '다진 마늘: 1스푼', '설탕: 2스푼', '진간장: 1스푼', '소금: 0.5스푼', '고춧가루: 2스푼', '식용유: 3스푼']",2인분,20분 이내,아무나,"['짜글이', '돼지고기짜글이', '짜글이만들기', '매콤달콤', '밥비벼먹기좋은', '앞다리살']"
6872681,https://recipe1.ezmember.co.kr/cache/recipe/2017/07/13/d4cc4f6ef0b271a18ab8d3603b692b421.png,끓이기,일상,돼지고기,국/탕,직장인 점심 메뉴 1위! 돈까스 김치나베,"[(1, '양파는 채썰고 대파는 송송 썰어 준비한다.'), (2, '채 썬 양파는 물에 담가둔다.'), (3, '돈가스를 튀겨 썰어 놓는다.'), (4, '뚝배기에 기름을 살짝 두르고 양파와 대파를 볶아 기름을 낸다.'), (5, '기름을 냈으면 김치를 넣어 볶은 후 김칫국물과 물을 붓는다.'), (6, '보글보글 끓으면 다진 마늘, 국간장, 설탕, 고춧가루를 넣는다.'), (7, '국물이 조금 줄어들면 튀긴 돈가스를 올린다.'), (8, '계란물을 가장자리에 부어주고 썰어 놓은 대파를 뿌린다.')]","['돈까스: 2장', '썬 배추김치: 1cup', '썬 양파: 1/2개', '송송 썬 대파: 1/2대', '계란: 2개', '식용유: 약간', '물: 2.5cup', '다진 마늘: 2T', '설탕: 1T', '고운 고춧가루: 1T', '국간장: 2T', '김칫국물: 1/2cup']",2인분,30분 이내,초급,"['돈까스김치나베', '돈가스', '돈까스', '김치나베', '김치', '나베', '점심', '일상', '얼큰', '매콤']"
6992894,https://recipe1.ezmember.co.kr/cache/recipe/2022/11/29/eaf75ac70a29bb1c29a78313b5d73ea41.jpg,끓이기,일상,돼지고기,국/탕,저탄고지 다이어트 얼큰삼겹탕,"[(1, '배추는 2cm너비로 썰어요.'), (2, '양배추는 1cm너비로 채 썰고 1/2등분으로 썰어요.'), (3, '대파는 어슷 썰어요.'), (4, '청양고추는 송송 썰어요.'), (5, '냄비에 대패삼겹살을 넣고 볶아요.'), (6, '기름이 나오기 시작하면 고춧가루, 마늘을 넣고 타지않게 볶아요.'), (7, '고추장을 넣고 뭉치지 않을 정도로만 볶아요.'), (8, '멸치다시마육수를 붓고 끓여요.'), (9, '끓기 시작하면 양배추와 배추를 넣고 2분간 끓여요.'), (10, '숙주와 대파를 넣고 1분간 끓여요.'), (11, '액젓으로 간을 맞춰요.'), (12, '후추를 넣어요.'), (13, '그릇에 담고 청양고추를 올려 완성해요.')]","['대패삼겹살: 300g', '숙주: 1줌', '양배추: 1/8통', '알배기배추: 3장', '대파: 1/2대', '청양고추: 1개', '멸치다시마육수: 650ml', '고춧가루: 1숟가락', '고추장: 1/2숟가락', '다진마늘: 1/2숟가락', '액젓: 1숟가락', '후추: 톡톡']",3인분,15분 이내,아무나,[]
6877051,https://recipe1.ezmember.co.kr/cache/recipe/2017/09/25/115f56499f49e784e727ec4b7e23adc91.jpg,끓이기,일상,돼지고기,찌개,대패 삼겹살 순두부 짜 글이 인기 메뉴,"[(1, '느타리버섯은 흐르는 물에 가볍게 헹궈 찢어주고 양파 대파 고추는 썰어 준비합니다 순두부는 반을 자른 후 그릇에 꺼내놓으면 편리해요'), (2, '분량의 양념을 만들고 간장3,설탕1/2,고추장1,고춧가루2/3 넣어 섞어줍니다 참기름과 후춧가루는 마지막에 사용합니다'), (3, '끓이기~냄비에 순두부와 양파 넣고'), (4, '양념과 멸치 육수 1컵을 부은 후 끓여주어요'), (5, '순두부가 보글보글 끓으면 대패 삼겹살을 넣고 끓이고'), (6, '삼겹살이 익을 즘 느타리버섯 대파 고추 넣어줍니다'), (7, '보글보글 한소끔 끓여 불 끄고 마지막에 참기름 1t과 후춧가루 솔솔 뿌려주어요'), (8, '느끼한 속을 확 날려주는 얼큰하고 맛있게 매운 대패 삼겹살 완성~')]","['대패 삼겹살: 300g', '순두부: 1봉지', '양파: 1/2개', '느타리버섯: 1줌', '청양고추: 2개', '홍고추: 1개', '대파: 1대', '다진 마늘: 1T', '생강즙: 약간', '간장: 3T', '맛술: 2T', '설탕: 1t', '고춧가루: 2/3T', '고추장: 1T', '참기름: 1t', '후춧가루: 약간', '멸치다시마 육수: 1컵']",3인분,15분 이내,아무나,"['순두부찌개', '순두부짜', '글이', '대패삼겹살', '삼겹살짜', '글이', '술안주', '저녁반찬', '짜글이']"
6860647,https://recipe1.ezmember.co.kr/cache/recipe/2016/11/14/9035f79e1eba76db7ff04c015dc9d0e31.jpg,끓이기,일상,돼지고기,찌개,삼겹살 순두부 짜글이,"[(1, '맛있는 우리돼지 삼겹살 준비하고요'), (2, '삼겹살은 먹기좋은 크기로 자릅니다'), (3, '대파 양파 청양고추 홍고추도 송송썰어 준비합니다'), (4, '순두부는 볼에 담아 듬성듬성 자르고'), (5, '돼지고기양념하기-전골냄비에 돼지고기를 한쪽으로 담아놓고 냄비를 약간기우려 물을 뺀 나머지 양념 모두 넣고 섞은 다음 고기에 버무려 양념이 배게 잠시둡니다'), (6, '잠시 재운 돼지고기는 약불에 올리고'), (7, '타지않게 뒤적거려 익혀주세요'), (8, '고기가 반이상이 익으면 양파 대파를 넣고 고루익도록 섞어주고'), (9, '고기가 다 익으면 물50cc를 붓고'), (10, '순두부를 넣고 살살 섞어줍니다'), (11, '순두부에 간이배면 불을 끄고 마무리합니다')]","['삼겹살: 350g', '순두부: 1봉지', '양파: 1/4개', '대파: 1대', '청양고추: 1개', '홍고추: 1/2개', '다진마늘: 1T', '다진생강: 약간', '고추장: 1T', '고춧가루: 1T', '설탕: 1t', '청주: 1T', '맛술: 1T', '참기름: 1t', '후춧가루: 약간', '간장(진/양조간장): 2T', '물: 50cc']",2인분,30분 이내,아무나,"['순두부짜글이', '순두부요리', '순두부', '삼겹살요리']"
6992423,https://recipe1.ezmember.co.kr/cache/recipe/2022/11/22/4910ea908dc778cf0276ff67069480cc1.png,끓이기,일상,닭고기,밑반찬,[식약처] 묵계밥,"[(1, '닭가슴살을 이용해 국물을 만든다.'), (2, '콩나물은 머리를 떼어내고 데쳐준다.'), (3, '3종류의 묵은 먹기 좋은 크기로 썰어준다.'), (4, '닭가슴살은 먹기 좋게 찢어 흰 후추, 버섯마늘 소금으로 밑간을 해준다.'), (5, '계란은 황백지단으로 부친 후 채 썰어준다.'), (6, '그릇에 밥을 담고 콩나물을 올리고 3종류의 묵을 올린 후 계란으로 고명해 완성한다.')]","['도토리묵: 25g', '올방개묵: 25g', '검정깨묵: 25g', '귀리 밥: 150g', '계란: 55g', '콩나물: 30g', '닭가슴살: 70g', '마늘: 10g', '대파: 10g', '양파: 15g', '맛간장: 15g', '흰후추: 1g', '버섯마늘 소금: 2g']",1인분,60분 이내,중급,"['식품의약품안전처', '마이나슈', '삼삼한밥상4권']"
6935670,https://recipe1.ezmember.co.kr/cache/recipe/2020/07/03/4570554d254cd9c0e9d45f5d04d5ba641.jpg,끓이기,일상,닭고기,밑반찬,밥솥 데리야끼 소스 만들기 +치킨 데리야끼,"[(1, '원래는 닭다리살 살만 바른 것 250g을 쓰는데 닭볶음용 조각이 있어서 그것으로 250g했어요. 어느것이든 상관없어요. 다만 닭볶음용은 뼈가 있어서 살이 조금 적어요 그래서 1인분으로 적당해요'), (2, '해동된 닭고기 토막 250g을 지퍼백에 넣고 진간장1T, 맛술 1T를 넣고 모아서 냉장고에 15분간 재워줄게요'), (3, '닭고기가 재워질 동안 밥솥에 진간장 50ml, 맛술75ml, 설탕3T넣고 재가열 9분 해서 소스를 가열해주세요'), (4, '설탕이 완전히 녹은 소스를 밥솥에서 모두 비워 따로 용기에 담으면 데리야끼 소스 완성 *이때 소스 반을 썼고요 보관해두셨다가 나머지는 다른 요리에 쓰시면 돼요'), (5, '밥솥을 그대로 씻지 않고 올리브유 1T를 부어 솥을 돌려서 고루 펴주세요'), (6, '간장과 맛술에 절여진 닭고기를 하나씩 앞뒤로 전분을 뿌려주세요. 전분에 굴리지 마시고 꼭 전반적으로 대충 살짝 뿌려주세요. 전분에 굴리면 나중에 익었을 때 전분 덩어리가 져요. *후라이팬으로 하실 경우는 전분에 굴려도 돼요'), (7, '전분을 앞뒤로 뿌린 닭고기 토막들을 밥솥안에 펴서 놓고 재가열 9분해주세요'), (8, '재가열 된 후 뒤집고'), (9, '위에 데리야끼 소스를 토막당 1T 고르게 붓고 재가열 9분해주세요'), (10, '다된 후 그릇에 덜고 남은 소스를 위에 끼얹어서 드세요')]","['닭고기: 250g', '식용유: 1T', '전분: 1T', '진간장: 50ml', '맛술: 75ml', '설탕: 3T', '진간장: 1T', '맛술: 1T']",1인분,30분 이내,아무나,"['밥솥', '데리야끼', '치킨']"
7005238,https://recipe1.ezmember.co.kr/cache/recipe/2023/06/28/50c8dfe01810ebb0868a11e2b5423aaa1.jpg,끓이기,일상,닭고기,메인반찬,국물이 꾸덕해서 맛있는 닭볶음탕,"[(1, '감자 2개 중 1개는 강판에 간다.'), (2, '대파는 반으로 갈라 5cm 길이로 썰고, 남은 감자 1개, 당근, 양파는 먹기 좋은 크기로, 청양고추는 송송 썬다.'), (3, '팬에 식용유, 고춧가루, 다진 마늘 1숟가락을 넣고 약불에서 살짝 볶는다. 고추기름이 나오기 시작하면 대파를 넣고 천천히 볶는다.'), (4, '대파 향이 올라오면 닭을 넣고 강불에서 1분간 익힌다.'), (5, '닭의 겉면이 익으면 간장과 설탕을 넣고 3분간 볶는다.'), (6, '물을 붓고 썰어둔 감자, 당근과 고추장, 된장을 넣어 잘 풀어준 뒤 중불에서 뚜껑 열고 10분간, 뚜껑 덮고 10분 더 끓인다.'), (7, '양파, 소고기 다시다, 갈아둔 감자를 풀어 넣고 끓인다.'), (8, '양파가 익으면 불을 끄고 바로 다진 마늘 1숟가락과 청양고추를 올리면 완성!')]","['닭(10호~12호): 1마리', '감자: 2개', '당근: 1/4개', '양파: 1/2개', '대파: 2대', '청양고추: 1개', '물: 2컵', '식용유: 2숟가락', '고춧가루: 3숟가락', '다진 마늘: 2숟가락', '진간장: 4숟가락', '설탕: 3숟가락', '고추장: 1숟가락', '된장: 1/2숟가락', '소고기 다시다: 1/2숟가락']",3인분,60분 이내,초급,"['1분요리뚝딱이형', '뚝딱이형레시피', '닭볶음탕', '닭요리', '집밥레시피', '집밥']"
6942478,https://recipe1.ezmember.co.kr/cache/recipe/2020/09/21/e2d8b6a54cd05631dc7523c50da831a81.jpg,끓이기,일상,닭고기,메인반찬,아이 밥반찬 닭안심으로 간단한 찜닭,"[(1, '양파, 당근, 감자, 대파는 먹기 좋은 크기로 썰어주세요.'), (2, '물 120ml, 간장 2T, 설탕 1/2T, 맛술 2T, 올리고당 1T, 다진 마늘 1스푼을 넣어 소스를 만들어주세요.'), (3, '팬에 소스를 넣고 끓여주세요.'), (4, '닭 안심은 먹기 좋은 크기로 썰어 준비해 주세요.'), (5, '소스가 보글보글 끓기 시작하면 닭 안심과 감자, 당근을 넣고 먼저 끓여주세요. 닭 안심 자체가 금방 익기에 데치는 과정은 생략하고 그대로 넣으시면 된답니다.'), (6, '재료들이 절반 정도 익으면 양파도 넣고 그대로 더 끓여주세요.'), (7, '당면 1줌도 함께 넣고 끓여주세요. 재료 손질 전 당면은 물에 불려 놓았어요.'), (8, '모든 재료들이 잘 익었다면 대파도 넣고 마지막으로 좀 더 끓여줍니다.'), (9, '통깨를 솔솔 뿌려주면 간단하게 완성이 되는 닭 안심 찜닭입니다.')]","['닭 안심: 200g', '양파: 1/2개', '당근: 조금', '감자: 1개', '대파: 1개', '당면: 1줌', '물: 120ml', '간장: 2T', '설탕: 1/2T', '맛술: 2T', '올리고당: 1T', '다진 마늘: 1스푼']",1인분,20분 이내,초급,"['찜닭', '닭안심요리', '닭요리', '닭고기', '간장찜닭']"
6932862,https://recipe1.ezmember.co.kr/cache/recipe/2020/05/18/11507d18b19cb3a4b1ec9dda2e662da61.jpg,끓이기,일상,닭고기,국/탕,밍글 최애 반찬♥슈렉 색깔 시금치 커리 만들기♥,"[(1, '시금치는 세척 후 뿌리를 제거 해요.'), (2, '닭가슴살은 원하는 크기로 깍둑썰기해요.'), (3, '냄비에 물을 받아 강불을 켜요. 소금을 투하해요.'), (4, '물이 끓으면 시금치를 20초 이내로 데쳐요.'), (5, '데친 시금치는 체로 건져 찬물에 헹궈요.'), (6, '데친 시금치를 믹서기에 갈아요.'), (7, '갈린 시금치를 따로 준비해요.'), (8, '프라이팬에 식용유를 두르고 강불을 켜요.'), (9, '다진마늘을 넣어 볶아요.'), (10, '닭가슴살을 넣어 볶아요.'), (11, '닭가슴살이 60%정도 익었을 때 준비한 카레 분말의 1/3을 투하해요.'), (12, '카레가루를 닭고기와 함께 볶으면 잡내제거에 탁월해요!'), (13, '나머지 카레가루는 물을 넣고 풀어요.'), (14, '잘 풀어진 카레 가루를 투하해요.'), (15, '한 번 끓여요.'), (16, '시금치 간 것을 투하해요!'), (17, '보글보글 할 때 까지 한 번 끓여요.'), (18, '마지막으로 휘핑크림을 투하해요.')]","['시금치: 350g', '닭가슴살: 189g', '다진마늘: 17g', '카레가루: 2T', '휘핑크림(or 요거트): 1T', '소금: 약간', '식용유: 약간']",4인분,20분 이내,초급,"['시금치', '카레', '시금치카레', '인도음식', '인도', '팔락파니르', '커리', '시금치커리', '슈렉', '건강']"
6945458,https://recipe1.ezmember.co.kr/cache/recipe/2020/11/02/2f061c2b4fa128b6d16278aade0fa0091.jpg,끓이기,일상,닭고기,국/탕,닭곰탕보다 더 맛있는 배추닭국 만들기+다대기 양념,"[(1, '재료는 간단해요~ 닭한마리와 알배추 반통, 대파 한대, 양파 반개를 준비해주세요~ 위 재료는 모두 필수입니다.'), (2, '닭은 손질할게요~ 닭껍질을 모두 제거하면 감칠맛이 덜하니 너무 꼼꼼히 떼어내진 말고 노랗고 하얀 지방이 뭉쳐져 있는 껍질들만 떼어내고'), (3, '내장과 핏기를 꼼꼼히 제거하며 깨끗하게 하나하나 씻어 체에 밭쳐 물기를 빼두세요~'), (4, '중강불로 냄비를 아주 뜨겁게 달군 후 참기름 넉넉히~ 7스푼 정도를 넣고'), (5, '손질한 닭을 넣고 촤아아~ 치이익~ 구워주세요~닭의 물기 때문에 기름이 마구 튀어오르니 조심하시고 ^^ 뒤적여가며 고루 익혀줍니다'), (6, '닭의 겉면이 모두 하얗게 익을때까지 구워주고 노릇하게 구워주면 더 좋아요~ 닭의 수분과 넉넉한 참기름 덕분에 타지 않으니 공들여 구우실 필요는 없어용~'), (7, '구워진 닭에 물 1.8리터와 대파 한대, 양파 반개 통후추 10알을 넣고 센불을 켜주세요~ 물은 처음부터 많이 잡지 않고 적은양으로 진하게 우려줄거예요~'), (8, '끓어오르기 시작하는 거품에는 참기름이 많이 섞여있으니 걷지 마시고 중앙까지 팔팔 끓어오르면 거품을 걷어내고 뚜껑을 덮어 중불로 줄여 40분간 끓여요~'), (9, '육수가 끓는 동안 알배추 반포기 큼직하게 숭덩숭덩 썰어놓고'), (10, '고명용 대파 찹찹찹 썰고'), (11, '고춧가루 3, 닭국물 4, 국간장 1, 다진마늘 1, 후추 톡톡 뿌려 섞어 양념다대기 만들어 둡니다.'), (12, '40분 후 양파, 대파, 통후추는 건져버리고 닭을 뼈만 바른다는 느낌으로 대충 찢어줍니다.'), (13, '뽀얀 닭국물에 찢은 닭과 배추 투하. 불은 중불.'), (14, '보글보글 끓어오르면 다진마늘 듬뿍 봉긋하게 한스푼 넣고 10여분 더 끓여줍니다'), (15, '배추가 익으면서 수분이 나오니까 물은 배추가 푹 익으면 저어보고 추가하세요~ 건더기파는 이대로 끝내도 되고 국물파이시면 물 두컵정도 더 넣으시면 돼요~'), (16, '배추줄기 숨이 죽으면 마지막으로 간하기~ 간은 오로지 소금으로만~ 2~3스푼 정도, 입맛에 맞게 넣어줍니다.'), (17, '온기가 오래 가도록 뚝배기나 도자기 그릇에 옮겨담고 파 소복하게 올려 후추 솔솔 뿌려내면 끝~ 국밥처럼 밥을 함께 담아내도 좋아요'), (18, '이보다 더 개운하고 진국일 순 없다. 만드는 과정도 들어가는 재료도 착한 닭배추국. 김치 종류만 바꿔주면 아침, 점심, 저녁 계속 먹어도 좋더라구요~'), (19, '양념다대기 풀어 빨갛게도 먹고~ 칼국수면도 넣어 먹고, 나중에 숙주나 고사리, 고춧가루 팍팍 넣고 닭개장처럼도 즐길 수 있답니다~'), (20, '한 솥 끓여 삼사일~ 반찬 걱정 안해도 되는 고마운 배추닭국 맛있게 드시고 따뜻하고 건강한 환절기 보내세요 :D')]","['볶음탕용 닭한마리: 1kg', '알배기배추: 1/2통', '대파: 1대', '양파: 1/2개', '통후추: 10알', '물: 1.8L', '참기름: 7큰술', '다진마늘 듬뿍: 1큰술', '소금: 2~3큰술', '후추: 약간', '고춧가루: 3숟가락', '닭국물: 4숟가락', '다진마늘: 1숟가락', '국간장: 1숟가락', '후추: 약간']",6인분 이상,60분 이내,아무나,"['닭배추국', '배추닭국', '닭곰탕', '닭국', '보양식', '국물요리', '아이국', '보양국', '닭요리', '배추요리']"
6896756,https://recipe1.ezmember.co.kr/cache/recipe/2018/09/29/304ebd02226f107371925fe3f2d83bbf1.jpg,끓이기,일상,닭고기,찌개,산뜻한 무수분 토마토 치킨스튜,"[(1, '재료준비'), (2, '- 토마토 열십자로 껍질만 칼집 낸 후 따뜻한 물에 담가놓기 Tip. 끓는 물에 데치는 대신 정수기 온수나 포트로 끓인 물을 부어놓으면 편하고 모든 재료 준비 후 껍질 벗기면 시간이 맞아요.'), (3, '- 닭가슴살 3cm 크기로 깍둑 썰어 소금 한 꼬집과 후춧가루 조금 넣어 밑간 해놓기 -마늘 두툼하게 슬라이스하기 - 양파 당근은 1cm, 파프리카 감자는 2cm 크기로 깍둑썰기 - 따뜻한 물에 담가놓은 토마토 껍질 벗긴 후 큼직하게 깍둑 썰기'), (4, '- 냄비에 올리브유 2큰술과 마늘 넣어 볶기'), (5, '- 마늘이 노릇해지면 양파, 감자, 당근, 파프리카, 닭고기 몽땅 넣어 볶기'), (6, '- 닭가슴살 겉면 색이 변하면 토마토와 월계수잎 넣어 고르게 섞은 후 뚜껑 덮고 약불에서 뭉근하게 끓이기 Tip. 중간중간 열어 바닥이 붙지 않게 저어줘요.'), (7, '- 토마토가 다 으깨지면케찹 넣어 조리기(30분 이상 소요)'), (8, '- 걸쭉한 농도가 되면 소금으로 간하고 후춧가루 넣어 마무리하기'), (9, 'Tip. 신맛이 강하면 설탕을 조금 넣어 신맛을 잡아주세요. - 월계수잎은 꺼내주세요.'), (10, '빵과 곁들여 내면 산뜻한 무수분 토마토 치킨스튜 완성~!')]","['닭 가슴살(230g): 1쪽', '토마토: 2개', '감자: 1개', '양파: 1/4개', '당근: 1/8개', '통마늘: 5개', '월계수잎: 2개', '미니 빨간 파프리카: 1개', '케찹: 4큰술']",2인분,60분 이내,아무나,"['스튜', '토마토', '토마토스튜', '치킨스튜', '무수분', '토마토치킨스튜', '아침메뉴', '닭가슴살', '브런치', '기념일']"
6841566,https://recipe1.ezmember.co.kr/cache/recipe/2016/01/14/b59de1b6b44e6d12d1ce23c22151dc421.jpg,끓이기,일상,닭고기,찌개,토마토 치킨 스튜,"[(1, '재료를 준비 해주세요.'), (2, '닭가슴살을 한 입 크기로 썰어 소금, 후추, 청주로 밑간 및 잡내 제거를 해주세요.'), (3, '토마토에 십자로 칼집을 넣어 끓는 물에 살짝 데친 후 차가운 물에 담궈 식히면서 껍질을 벗겨냅니다. 껍질을 벗긴 토마토는 8등분으로 썰어주세요.'), (4, '베이컨은 한입 크기로 썰어주세요.'), (5, '당근, 감자, 양파, 브로콜리는 닭가슴살과 비슷한 크기로 썰어주세요. 그리고 마늘은 저미고, 양송이는 4등분으로 썰어 주세요.'), (6, '팬에 버터를 녹인 후 밑간을 한 닭가슴살을 익히다 색이 변하면 그릇에 따로 담아두세요.'), (7, '닭가슴살을 볶던 팬에 버터를 더 녹인 후 마늘, 베이컨, 양파, 당근, 감자, 양송이, 브로콜리 순으로 볶아주세요.'), (8, '냄비에 오일을 두르고 페이스트를 볶다가 닭고기, 채소를 넣어 같이 볶아주세요.'), (9, '채소가 잠길만큼 물을 붓고 월계수잎, 바질을 넣고 30분 정도 끓여주세요.'), (10, '모든 재료가 익으면 토마토를 넣고 소금, 후추로 간을 한 후 10분 정도 끓이면 완성입니다.')]","['닭가슴살: 1조각', '완숙 토마토: 1개', '양파: 1/2개', '감자: 1/2개', '당근: 1/2개', '양송이버섯: 2개', '브로콜리: 1/3개', '마늘: 2톨', '베이컨: 2줄', '토마토 페이스트: 3큰술', '버터: 1큰술', '월계수잎: 1장', '바질: 약간', '청주: 적당량', '소금: 약간', '후추: 약간', '오일: 적당량']",2인분,60분 이내,초급,"['닭고기', '토마토', '다이어트', '간편요리', '닭가슴살', '일상요리', '스튜', '짜투리채소']"
7051072,https://recipe1.ezmember.co.kr/cache/recipe/2025/04/16/fcc04265c1197172f2f6b0478d02810a1.jpg,끓이기,일상,채소류,밑반찬,46.풋마늘 장아찌(ft.구운 고기와)(2025.4.24),"[(1, '풋마늘대를 잘 씻어 물기를 털고 2cm길이로 잘라 소독한 유리병이나 스텐레스 용기에 담아요.'), (2, '소주와 식초를 제외하고 다른 재료를 팔팔 끓으면 불 끄고,이제 소주와 식초를 부어 뜨거울 때 통에 부어요.'), (3, '그 다음 날 장물을 다시 한번 끓여 뜨거울 때 부었더니 제대로 맛이 나네요.'), (4, '응용: 구운 오리고기와 곁들여 쌈했더니 맛있네요^^')]","['풋마늘대: 500g', '다시마 우린 물: 200ml', '간장: 200ml', '매실액: 50ml', '참치액: 3스푼', '소주(or 정종): 3스푼', '식초: 50ml']",3인분,30분 이내,아무나,"['풋마늘장아찌', '풋마늘요리', '제철음식', '봄철요리', '벚꽃조이나요리', '건강한음식', '면역력', '육류와곁들이는']"
